{
    "$schema": "http://json-schema.org/draft-07/schema#",
    "title": "Work experience",
    "description": "content/data/work-experience.json: jobs and research positions shown in the Experience section (homepage and /work-experiences) and on the resumes. Array of entries, newest first.",
    "type": "array",
    "items": {
        "type": "object",
        "required": [
            "title",
            "organization",
            "start",
            "end",
            "description"
        ],
        "properties": {
            "title": {
                "type": "string",
                "description": "Your role, e.g. \"Graduate Student Researcher\"."
            },
            "organization": {
                "type": "string",
                "description": "Company, lab or university. Shown under the logo (use this key, not \"company\")."
            },
            "start": {
                "type": "string",
                "description": "Start date. Free text, shown as written (e.g. \"Sep 2024\", \"2023\", \"Present\").",
                "examples": [
                    "Sep 2024",
                    "Present"
                ]
            },
            "end": {
                "type": "string",
                "description": "End date, or \"Present\". Free text, shown as written (e.g. \"Sep 2024\", \"2023\", \"Present\").",
                "examples": [
                    "Sep 2024",
                    "Present"
                ]
            },
            "location": {
                "type": "string",
                "description": "Location, e.g. \"Example City, CA\" or \"Remote\"."
            },
            "image": {
                "type": "string",
                "description": "Logo (shown as a circle). Path of an image under public/, starting with \"/\" (e.g. \"/images/lab-logo.png\"). Rendered with next/image, so remote URLs and paths without the leading slash break the page. Defaults to /images/placeholder.png.",
                "pattern": "^/",
                "examples": [
                    "/images/placeholder.png"
                ]
            },
            "description": {
                "type": "string",
                "description": "What you did. Each line (separated by \\n) becomes a bullet; an empty string shows \"In progress\". Required: the Experience section crashes without it. Must be a string, not an array."
            },
            "skills": {
                "type": "array",
                "description": "Skills/technologies, shown as badges.",
                "items": {
                    "type": "string"
                }
            },
            "links": {
                "type": "object",
                "description": "Buttons shown under the entry: an object mapping the button label to its URL, e.g. {\"GitHub\": \"https://...\", \"Paper\": \"https://...\"}. Labels containing preprint/paper/code/github/demo/slides/video/poster/website get matching icons.",
                "additionalProperties": {
                    "type": "string",
                    "description": "URL (absolute, or a path under public/ such as /assets/slides.pdf)."
                },
                "examples": [
                    {
                        "GitHub": "https://example.com/code",
                        "Paper": "https://example.com/paper.pdf"
                    }
                ]
            },
            "collaborators": {
                "type": "array",
                "description": "People you worked with, shown as \"Collaborators: A, B\" with links.",
                "items": {
                    "type": "object",
                    "required": [
                        "name"
                    ],
                    "properties": {
                        "name": {
                            "type": "string",
                            "description": "Collaborator's name."
                        },
                        "link": {
                            "type": "string",
                            "description": "Link to their homepage or profile (optional)."
                        }
                    }
                }
            },
            "show_on_homepage": {
                "type": "boolean",
                "description": "Set to false to list this entry only on /work-experiences, not on the homepage.",
                "default": true
            },
            "show_on_website": {
                "type": "boolean",
                "description": "Set to false to hide the entry on the website.",
                "default": true
            },
            "show_in_resume": {
                "type": "boolean",
                "description": "Include in the full CV (scripts/generate_resumes.py).",
                "default": true
            },
            "show_in_resume_short": {
                "type": "boolean",
                "description": "Include in the short resume.",
                "default": false
            },
            "resume_organization": {
                "type": "string",
                "description": "Shorter organization name for the resumes, e.g. \"Reliable ML Lab\" instead of \"Reliable ML Lab, Example University\"."
            },
            "resume_type": {
                "type": "string",
                "description": "Right-hand label on the full CV, e.g. \"Research Project\". The four-part CV heading is used only when both resume_type and resume_skills are set (full CV only)."
            },
            "resume_skills": {
                "type": "string",
                "description": "Comma-separated skills shown on the resume heading, e.g. \"Python, PyTorch\". A single string, not an array."
            },
            "resume_description": {
                "type": "array",
                "description": "Bullets for the full CV. Defaults to the lines of description. LaTeX: & % _ $ are escaped automatically unless already escaped; other LaTeX commands (e.g. \\\\textbf{...}) pass through.",
                "items": {
                    "type": "string"
                }
            },
            "resume_short_description": {
                "type": "array",
                "description": "Bullets for the short resume. Defaults to the lines of description. LaTeX: & % _ $ are escaped automatically unless already escaped; other LaTeX commands (e.g. \\\\textbf{...}) pass through.",
                "items": {
                    "type": "string"
                }
            }
        }
    }
}
